company_name,job_title,company_location,company_rating,salary,job_type,job_desc,apply_link
MileOne Autogroup,Data Analyst *ONSITE ONLY*,"1 Olympic Place, Towson, MD 21204",3.0 out of 5,,Full time,"** THIS POSITION WILL BE 100% IN OFFICE ** MileOne Autogroup is seeking a detail-oriented Data Analyst who will help us to enhance our growing analytics and business intelligence capabilities. The company has embraced and benefited from BI functions that have been implemented in the past 7 years, both in terms of units sold and profitability. This individual will help to expand data-driven processes and serve as a key member of the team that will set the direction for enterprise-wide BI efforts . Working under the supervision of the BI Manager, the ideal candidate will have the unique opportunity to interact with internal and external stakeholders including senior leaders and vendors to create and leverage best-in-class business intelligence capabilities in support of business objectives. The ideal candidate should have a passion for turning data into actionable insights. The Data Analyst position is ideal for a motivated and highly capable self-starter with a strong business acumen and sharp analytical and communication skills. Job Responsibilities: Qualifications: Our Employee Advantage: We believe that taking care of employees is an important step in creating a positive workplace and a successful company. With that in mind, MileOne is proud to offer programs designed to help our employees and their families’ succeed both at home and at work. We call it the MileOne Employee Advantage! In addition to traditional healthcare, training, career advancement and financial benefits, we also include an Employee Purchase Program, the Next Mile scholarship program for employees and family members, an Employee Assistance Program and more. MileOne Autogroup is dedicated to actively helping our communities, we have raised millions through local and national charities. For more information, visit our website MileOneJobs.com and click “Why MileOne”. MileOne Autogroup is an equal opportunity employer and we maintain a drug free work environment. By applying for this job, you agree to receive email communication, as well as telephone and/or SMS text communications using an autodialer or otherwise, at the number you have provided. Message and data rates may apply; text STOP to opt out after receiving text communications. Job Type: Full-time Pay: $5.00 per hour Expected hours: 40 per week Benefits: Compensation package: Experience level: Schedule: Experience: Ability to Relocate: Work Location: In person",https://www.indeed.com/cmp/Mileone-Autogroup?campaignid=mobvjcmp&from=mobviewjob&tk=1i2stfuc3i01v800&fromjk=e252427e9e12eed6
NS IT Solutions LLC,Entry Level BA,"Herndon, VA",,,,"We are a full service Information Technology firm. We specialize in superior quality consulting and staffing solutions to our client partners. We team up with the leading Technology, Software and Service partners to cover the full range of core competencies needed to deliver best-in-class solutions. Our Business/Management Analysis and Quality Assurance/Regulatory Compliance consulting group provides customers with unparalleled industry experience. By making wise IT investments and fundamental changes to business models, Organizations can reduce their costs, empower consumers, improve the quality and increase the speed of new applications to market. The primary duties of the Business Analyst will include:-  What's On Offer If you are seeking a chance to take the next step in your career to join a progressive and fast-moving company, this is a superb opportunity for you. Requirements:   Our core expertise is in Quality Assurance, Business Analysis, Data Analysis. Fresh College Graduates may also apply provided they are eligible to work in the US. All your information will be kept confidential according to EEO guidelines.",https://www.indeed.com/cmp/Ns-IT-Solutions-LLC?campaignid=mobvjcmp&from=mobviewjob&tk=1i2stg4hqi02n800&fromjk=7d7a9d1f848f4e14
Valsatech Corp,Business Analyst || REMOTE || Contract Role,,4.6 out of 5,$60 - $65 an hour,Contract,"Hi This is regarding to a position of a Business Analyst Title: Business Analyst Duration: Long-term Contract Client is State of Wyoming Location: REMOTE (Twice a Month onsite) The Analyst shall be able to evaluate data collected through task analyses, business processes, surveys, and workshops, as well as prepare and deliver recommendations during the development process to enable the Agency’s business needs. The analyst shall have the ability to prepare detailed project documentation, and document results of analysis and workflows. The Analyst shall design and execute test scripts and test scenarios, and coordinate with the business units during the testing and validation of new applications and services as well as enhancements to existing applications and services. (5) years of experience as an Analyst including prior experience working on public sector healthcare system implementation projects; Job Type: Contract Pay: $60.00 - $65.00 per hour Schedule: Work Location: Remote",https://www.indeed.com/cmp/Valsatech-Corp?campaignid=mobvjcmp&from=mobviewjob&tk=1i2stganvgsui800&fromjk=9a3571fac89d09b9
"InterMetro Industries, Corporation",Data Analytics Specialist,"Wilkes-Barre, PA",,,Full time,"InterMetro Industries Corporation is seeking a Data Analytics Specialist for our Corporate HQ located in Wilkes-Barre, PA. The Data Analytics Specialist will possess a strong software mindset and passion for data generation. This position will require heavy use of Power BI or similar software tools. The role will provide analytics support to executive leadership to enable them to better understand, monitor, and manage the business on an ongoing basis. The ideal candidate will possess a strong IT education and/or experience. The Data Analytics Specialist will be a key member of the Finance Team.  Primary Responsibilities:  Qualifications:  What We Offer:  InterMetro Industries is an Equal Opportunity/Affirmative Action employer. All qualified applicants will receive consideration for employment without regard to sex, race, color, religion, national origin, age, marital status, political affiliation, sexual orientation, gender identity, genetic information, disability or protected veteran status. We are committed to providing a workplace free of any discrimination or harassment. No calls or agencies please. InterMetro Industries will only employ those who are legally authorized to work in the United States. This is not a position for which sponsorship will be provided. Individuals with temporary visas such as E, F-1, H-1, H-2, L, B, J, or TN or who need sponsorship for work authorization now or in the future, are not eligible for hire. Relocation assistance is not available for this position. If you need an accommodation to apply for this position, please email careers.metro@metro.com. Please allow for 24-48 hours for us to respond. #LI-AL1","https://www.indeed.com/cmp/Intermetro-Industries,-Corporation?campaignid=mobvjcmp&from=mobviewjob&tk=1i2stggk2i02p87b&fromjk=a33880dd381f62c3"
"United Power, Inc",GIS Analyst I-IV,"500 Cooperative Way, Brighton, CO 80603",3.8 out of 5,"$70,750 - $98,600 a year",Full time,"United Power has an exciting opportunity for GIS and Data Analyst. This job has 4 classification levels; We are looking to hire at any level. Level will be determined based on applicable experience and education. Fully Remote is not an option: All candidates must be willing and able to be on-site with limited notice. Please visit www.unitedpower.com/careers for a full job description. Job Title: GIS and Data Analyst I/II/III/IV Location: Brighton Position Purpose and Objectives: Embracing and supporting the cooperative's vision and mission, this role provides dependable and high-performance Geographic Information System (GIS) and geospatial services under the guidance of the GIS Manager. Ensuring accuracy, integrity, and value of GIS data, the position contributes to an excellent user experience and advances the core business of electric power delivery. Responsibilities encompass maintaining, progressing, and supporting the GIS environment, integrating with enterprise systems, and participating in assigned projects. The GIS environment includes server or cloud-based GIS products, desktop GIS and staking applications, mobile GIS applications, web GIS applications, geodatabases, and GPS hardware and applications. Job Classification and Progression: The GIS and Data Analyst class series consists of four positions: GIS and Data Analyst I, GIS and Data Analyst II, GIS and Data Analyst III, and GIS and Data Analyst IV. Positions in the GIS and Data Analyst class series are flexibly staffed and positions at higher levels are typically filled by advancement from the lower levels after gaining the necessary knowledge, skills, experience, and certifications. Level I: At this level, incumbents with basic GIS experience learn and perform specialized computer-based and graphical support work. They become familiar with GIS base map creation and maintenance, and the processes necessary to collect, interpret, and display GIS data. While performing duties similar to the higher levels, incumbents at this level are guided by established procedures and protocols, exercising discretion and applying independent judgment to a limited extent. They may seek support and review from peers as they develop their skills and knowledge within the team. Level II: At this level, incumbents are fully skilled in using GIS tools to maintain GIS models and data. They are capable of administering and managing GIS platforms, given specific direction and guidance from the GIS Manager, while increasing degrees of independence. Incumbents demonstrate proficient discretion and independent judgment in executing tasks, adhering to established operating procedures and policies within the work unit. They contribute to problem-solving efforts and decision-making processes, drawing upon their expertise to ensure the effective utilization of GIS resources and technologies. Level III: Incumbents at this level are expected to perform activities with broad direction from the GIS Manager, demonstrating a high level of discretion and independent judgment. They solve complex problems independently or lead collaborative groups in solving complex problems, drawing upon their expert-level understanding and skills in administering and managing GIS platforms on Windows servers. This includes a comprehensive understanding of Windows operating systems to support GIS components. They actively contribute ideas that shape GIS initiatives and adopt innovative practices that propel the organization's GIS capabilities forward. Level IV: At this advanced stage, incumbents demonstrate mastery in GIS and data analysis, exhibiting the highest level of discretion and independent judgment. They provide strategic direction for GIS initiatives, leading teams in the development of GIS solutions, and making significant contributions to the advancement of the organization's GIS capabilities. Incumbents at this level are recognized experts in administering and managing GIS platforms, possessing advanced problem-solving skills and the ability to navigate complex challenges with finesse. They are the go-to resource for resolving intricate issues and driving transformative change within the GIS domain. Education, Training and Experience: Level I Equivalent to an associate degree with major coursework in geography, computer science, information systems or a closely related field. Equivalency may be demonstrated through a combination of training and progressively responsible experience that resulted in the required specialized knowledge and abilities to perform the assigned work in lieu of a degree, AND combined 6 months hands-on experience working with GIS software productsrelated to cartography, analysis, and geoprocessing, that demonstrates a solid working knowledge of these tools. Level II Equivalent to graduation from a four-year college or university with major coursework in geography, computer science, information systems or a closely related field. Equivalency may be demonstrated through a combination of training and progressively responsible experience that resulted in the required specialized knowledge and abilities to perform the assigned work in lieu of a degree, AND combined two (2) years hands-on experience working with GIS software products related to cartography, analysis, and geoprocessing, that demonstrates in-depth knowledge of using these tools, with basic to intermediate knowledge and experience in querying data in relational databases, such as Microsoft SQL Server and Python for intermediate level automation tasks. AND at least (1) year of hands-on direct work experience in basic configuration and administration of server or desktop GIS technologies and systems. Relevant technical certifications, current training, plus demonstrated work experience as the technical lead for routine/small technical projects preferred. Level III Level II plus A combined four (4) years hands-on experience working with GIS software products related to cartography, analysis, and geoprocessing, that demonstrates in-depth knowledge of using these tools, with intermediate to advanced knowledge and experience in querying data in relational databases, such as Microsoft SQL Server and Python for intermediate level automation tasks. AND two (2) years of hands-on direct work experience in intermediate to advanced configuration and administration of server and desktop GIS technologies and systems. Relevant advanced technical certifications, current training, including successful completion of one or more of the following Esri Technical Certification Exams preferred: Plus demonstrated work experience as the technical lead for large technical projects preferred. Level IV Level III plus An additional four (4) years of hands-on direct work experience in advanced configuration and administration of server and desktop GIS technologies and systems. AND relevant advanced technical certifications and current training, including successful completion of one or more of the following Esri Technical Certification Exams: AND demonstrated work experience as the technical lead for large technical projects required. AND at least one (1) year of proven work experience demonstrating responsibilities focused on strategic planning for enterprise GIS solutions, as well as leading teams in the development and/or deployment of innovative GIS solutions. Typical hiring range: Level I: $70,750 - $78,200 with a grade maximum of $85,650 annually Level II: $78,200 - $84,500 with a grade maximum of $90,800 annually Level III: $84,500 - $91,300 with a grade maximum of $98,100 annually Level IV: $91,300 - $98,600 with a grade maximum of $105,900 annually In addition to a competitive salary, we offer a generous benefits package that includes an employee retirement plan, 401K with match, paid holidays, vacation & sick leave, medical, dental, vision, short-term disability, long-term disability, and life insurance. For a full list of benefits, please visit our careers page at https://www.unitedpower.com/careers. United Power is an Equal Employment Opportunity Employer. United Power prohibits discrimination against applicants or employees on the basis of age 40 and over, race, gender identity, sex, sexual orientation, color, religion, military or veteran status, national origin, disability, genetic information or any other applicable status protected by state or local law. We are interested in every qualified candidate who is eligible to work in the United States. However, this position is not eligible for visa sponsorship. Job Type: Full-time Pay: $70,750.00 - $98,600.00 per year Benefits: Experience level: Schedule: Experience: Ability to Commute: Ability to Relocate: Work Location: Hybrid remote in Brighton, CO 80603",https://www.indeed.com/cmp/United-Power?campaignid=mobvjcmp&from=mobviewjob&tk=1i2stgmopi9tm800&fromjk=db7e2e6344ef58fb
Genesis Logistics Inc.,Warehouse Mgmt. Systems (WMS) Analyst I,"705 Bradburn Place, Stafford, VA 22554",2.6 out of 5,,Full time,"WMS Analyst I Are you a tech-savvy problem solver with a passion for optimizing warehouse management systems? Do you love analyzing data and collaborating with cross-functional teams to deliver top-notch results? If you're nodding your head ""yes"" to these questions, then we want YOU!  As our WMS Analyst II, you'll be our go-to guru for implementing and maintaining warehouse management systems. You'll work with a dynamic team to analyze data, identify operational inefficiencies, and develop solutions to optimize our systems. You will have the opportunity to work with cutting-edge technology and contribute to the ongoing growth and success of our organization that will allow DHL Supply Chain to continue delivering excellence to our customers.  Role Responsibilities:  Required Education and Experience  Our Organization has a business casual environment and focuses on teamwork, associate development, training, and continuous improvement. We offer competitive wages, excellent affordable insurance benefits (including health, dental, vision and life), 401K plan, paid vacation and holidays. Our Organization is an equal opportunity employer. #LI-Onsite",https://www.indeed.com/cmp/Genesis-Logistics-Inc.?campaignid=mobvjcmp&from=mobviewjob&tk=1i2stgssdhie9806&fromjk=d134123d02c5e7f3
Farallon Consulting LLC,Environmental Data Analyst,Washington State,2.6 out of 5,"$60,000 - $90,000 a year",Full time," Farallon Consulting, L.L.C. has a full-time opening for a full-time Environmental Data Analyst. This can be a remote position from approved locations in the Pacific time zone or based out of any of our West Coast offices. About us Farallon’s outstanding reputation for resolving challenges on a broad array of environmental projects is the result of the expertise and dedication of highly motivated professionals working toward a common goal. To build on this reputation, Farallon is committed to attracting high-quality people and retaining them for the long term. Farallon provides an integrated suite of environmental consulting services to a wide range of private- and public-sector clients. Specialty areas include environmental due diligence, site characterization, engineering and remediation services, stormwater management, and mediation and litigation support. The firm is headquartered in Issaquah, Washington, with offices in Seattle, Gig Harbor, Wenatchee, and Bellingham, Washington; Portland and Baker City, Oregon; and Oakland, and Irvine, California. What we are looking for We are looking for an Environmental Data analyst who will work with Farallon’s scientists and engineers to review and manage environmental data for environmental reporting using EQuIS, SQL Server Management Studio, and Microsoft Office. The position will consist of full-time data management including data upload and retrieval to cloud-hosted relational databases, performing quality control on laboratory data, and generating summaries of results. What’s in it for you? What you will be doing at Farallon: What you will need to succeed: Ideally, you’ll also have: Don’t meet every single requirement for the role? Studies have shown that women and people of color are less likely to apply to jobs unless they meet every single qualification. At Farallon, we are dedicated to building a diverse, inclusive, and authentic workplace, so if you’re excited about this role but your past experience doesn’t align perfectly with every qualification in the job description, we encourage you to apply anyway. You may be just the right candidate for this or other roles with our firm. Pay Range Our best estimate of the base salary range for this position, is $60,000 – $90,000. Compensation offered will be based on a variety of individual factors, including education and experience, as well as internal equity. Farallon reviews and updates salary ranges annually, and employees are eligible for pay increases based on individual performance. The typical base salary range for this position is just one component of Farallon’s total compensation package for our employee-owners. Benefits We are proud of the benefits we offer to our employee-owners, including: Apply for Environmental Data Analyst If you would like to be considered for this position with the Farallon team, submit a resume online at http://www.farallonconsulting.com/careers/current-openings. Farallon Consulting, L.L.C. is an EEO employer and all qualified candidates will receive consideration without regard to race, color, religion, national origin, citizenship, genetic information, age (except for bona fide occupational qualifications), sex, pregnancy (including childbirth or a related medical condition), disability, sexual orientation, gender identity, gender expression, marital status, military leave or service, status as a disabled veteran or other covered veteran status, participation in EEO protected activity, any other status protected by federal, state, or local law, or association with a person on the basis of one or more of the foregoing.",https://www.indeed.com/cmp/Farallon-Consulting?campaignid=mobvjcmp&from=mobviewjob&tk=1i2sth3frh3n7800&fromjk=d2c13b234edba1f4
IQ Inc,Data Analyst,"IQ Inc in Pittsburgh, PA 15219",4.3 out of 5,"$65,000 - $80,000 a year",Full time,"We are seeking a highly skilled Data Analyst specializing in Power BI and Agile/Scrum processes to join our software development teams. In this role, you will work closely with various technical and business segments to identify requirements, maintain and enhance reporting for critical metrics, and design and implement BI solutions as needed. Candidates will need to possess strong communication and presentation skills for collaborating with stakeholders, as well as strong organizational and project management skills for coordinating processes cross-functionally. This role will require some degree of on-site work (approximately 2 days a week) in Pittsburgh, PA. Local candidates are strongly preferred. Qualities that might make a strong candidate: Nice-to-haves: IQ Inc. provides equal employment opportunities (EEO) to all employees and applicants for employment without regard to race, color, religion, sex, national origin, age, disability or genetics. In addition to federal law requirements, IQ Inc. complies with applicable state and local laws governing nondiscrimination in employment in every location in which the company has facilities. This policy applies to all terms and conditions of employment, including recruiting, hiring, placement, promotion, termination, layoff, recall, transfer, leaves of absence, compensation and training. IQ Inc. expressly prohibits any form of workplace harassment based on race, color, religion, gender, sexual orientation, gender identity or expression, national origin, age, genetic information, disability, or veteran status. Improper interference with the ability of IQ Inc.’s employees to perform their job duties may result in discipline up to and including discharge. Job Type: Full-time Pay: $65,000.00 - $80,000.00 per year Benefits: Experience level: Schedule: Application Question(s): Ability to Commute: Work Location: Hybrid remote in Pittsburgh, PA 15219",https://www.indeed.com/cmp/Iq-Inc.?campaignid=mobvjcmp&from=mobviewjob&tk=1i2sth9s0i0ha80j&fromjk=367284d870deac37
Skanska USA,Data Visualization Specialist,"4235 Southstream Blvd Ste 200, Charlotte, NC 28217",4.1 out of 5,,Full time,,https://www.indeed.com/cmp/Skanska?campaignid=mobvjcmp&from=mobviewjob&tk=1i2sthfp7i0jv800&fromjk=2cfbc3ee558faa19
