company_name,job_title,company_location,company_rating,salary,job_type,job_desc,apply_link
Steneral Consulting,Remote Work - Need Contact Center BA- locals to MA only,"Boston, MA 02115",,,"Part time, Seasonal, Full time, Internship","must have must be local! Business Analyst Contact/Call Center experience Healthcare highly preferred Current and future state processes  Location: local only they can work remotely and come onsite once a month or so Start: ASAP  They need to have BA Healthcare experience and will be gathering requirements and building test plans. This will be a BA supporting the Phone Systems Replacement project. They are replacing the old Avaya system with RingCentral, and need to do other work that's adjacent to the RingCentral part of the project due to the impacts of switching to a VOIP system.  Below is some information from WellSense leadership regarding what they are looking for now: ",https://www.indeed.com/cmp/Steneral-Consulting?campaignid=mobvjcmp&from=mobviewjob&tk=1i2stsb39h3m5801&fromjk=53b6e57c6b180c5f
Newport Mental Health,Healthcare Data Analyst,"127 Johnny Cake Hill Rd, Middletown, RI 02842",2.4 out of 5,,Full time,"Newport Mental Health (NMH) is a progressive high-energy organization that uses state of the art person-centered recovery approach to help individuals recover from mental illness and substance use disorders. NMH extends its trauma informed evidence-based services to children, adolescents, families, and adults. Our services vary from outreach, specialized program, mental health, school-based therapy, substance use therapy, community-based therapy, and outpatient clinic. For more information visit our website: www.newportmentalhealth.org WHO WE ARE LOOKING FOR… Mission- Aligned: You are excited to be a part of Newport Mental Health’s mission to improve the lives of our clients living and working in Newport County by providing the highest quality of care. Ally: You intentionally foster belonging, personal growth, and empowerment for all. You’re a strong advocate for the BIPOC, LQBTQIA+, Woman, Veteran, and other underrepresented communities. Solution Orientated: You are driven to think of different approaches to narrow the gap which leads to positive and effective changes. Time Management: You are a conscious planner and a thoughtful decision maker who adheres to deadlines. WHAT WE OFFER… WHAT YOU WILL BE DOING (ESSENTIAL DUTIES) … We are seeking a talented and motivated Healthcare Data Analyst to join our team. As a Data Analyst, you will play a crucial role in analyzing and interpreting complex healthcare data using electronic health record (EHR) systems, SQL, and Power BI. Essential Duties: Perform advanced data analysis using electronic health record (EHR) systems, SQL, and other tools to extract, manipulate, and interpret healthcare data. Develop and maintain robust data models, databases, and reporting frameworks to support the analysis and visualization of healthcare data. Collaborate with cross-functional teams, including healthcare professionals, IT staff, and management, to identify data needs, develop analytical strategies, and provide insights for decision-making. Design and generate meaningful reports, dashboards, and visualizations using tools such as Power BI, ensuring data accuracy, relevancy, and accessibility for stakeholders. Conduct in-depth data analysis to identify trends, patterns, and opportunities for process improvement, cost reduction, and enhanced patient care outcomes. Stay up-to-date with industry trends, emerging technologies, and regulatory requirements related to healthcare data analysis and reporting, and proactively apply this knowledge to enhance data analysis practices. Ensure adherence to data governance and privacy regulations while handling sensitive healthcare information. Collaborate with IT teams to optimize data collection, integration, and storage processes to improve data quality and accessibility. WHAT WE EXPECT OF YOU… APPLY NOW Submitting your application is a great way to learn more about Newport Mental Health. If you have questions about how your experience aligns with our job openings or know someone who would be a great candidate for our job openings, please contact Human Resources: Human Resources Newport Mental Health 127 Johnny Cake Hill Road Middletown, RI 02842 Tel: 401-846-1213 Fax: 401-324-6251 Newport Mental Health is an Equal Opportunity Employer. All qualified applicants will receive consideration for employment without regard to race, color, religion, sex, sexual orientation, gender identity, or national origin.",https://www.indeed.com/cmp/Newport-Mental-Health?campaignid=mobvjcmp&from=mobviewjob&tk=1i2stsh4lgo5b807&fromjk=a73fa8700763fbd5
Universal Service Administrative Company,Program Analyst - Outreach,"700 12th St NW Ste 900, Washington, DC 20005",3.6 out of 5,"$60,000 - $88,000 a year",,"USAC’s target compensation range for a new hire into this position is $60,000 - $88,000 USD per year. Actual salary may vary depending on job-related factors based on knowledge, skills, and experience, as evaluated throughout the interview process. In addition, this position may be eligible for an annual performance bonus. USAC has a comprehensive benefits package that includes Medical, Dental, Vision, 401 (k), FSA, Life Insurance, Paid Time Off, Commuter Benefits and Wellness Programs.  Why Work Here? Our mission to achieve universal service addresses America’s current critical needs to build out broadband capabilities for telehealth, online learning, and keeping families connected. Join us and help USAC accomplish our mission to bridge the digital divide. Through its administration of the $10 billion Universal Service Fund (USF) programs on behalf of the FCC, USAC works to promote the availability of quality services at just, reasonable and affordable rates and to increase access to advanced telecommunications services throughout the nation. Additional information on USF programs can be found at: https://www.usac.org/about/ Benefits USAC supports our employees well beyond their salary with a system of benefits that rivals the top organizations in the country. Simply put: if you are committed to improving the lives of others, we are committed to improving yours. USAC provides low-premium, top-of-the-line medical, dental, and vision insurance in addition to disability and life coverage. Generous 401k contribution, Federal and floating holidays, paid sick leave and vacation time that increases every year. Regular telework schedule and opportunities to take professional development courses and training. A Multicultural Team We have actively built an organization that doesn’t just celebrate our diversity; we depend on it. The challenges of achieving universal service require creative and unique perspectives. Our accepting and inclusive community will challenge you to grow and learn from others while always recognizing the value of your contribution. To apply, please submit a cover letter and resume, click the “Apply For This Job Online” button. USAC employees are passionate about our mission. Our work contributes to the success of all Americans. We’ve worked together to build a culture that is collaborative, ambitious, outcome-oriented, and feedback-focused. As USAC continues to support universal service impacting healthcare providers, educators, and consumers, it is critical now more than ever that we hire people equally passionate and committed to helping fulfill our mission. We are currently seeking a dynamic and collaborative professional to serve as Program Analyst. This is an outstanding career opportunity for an individual interested in a genuine professional challenge in support of a public-spirited mission. Working in a creative and fast-paced environment, the Program Analyst will analyze data to support one of USAC’s four core programs by identifying process improvements and efficiencies, working with management and applicants to resolve issues that may affect funding, develop and manage performance and funding-related reports.  Responsibilities  About You The successful candidate will excel at operating in a diverse and fluid environment and will be crucial for the success of the Schools and Libraries Department. USAC is committed to providing a safe and healthy workplace for all employees. All offers of employment with USAC are conditioned on completing and passing a background and reference check. USAC is an Equal Opportunity Employer. No agencies please. ",https://www.indeed.com/cmp/Universal-Service-Administrative-Company?campaignid=mobvjcmp&from=mobviewjob&tk=1i2stsn94goqu800&fromjk=c0785cda0c56cb57
Millennium Physician Group,Value Based Care Attribution Analyst,"Fort Myers, FL 33912",3.4 out of 5,,Full time,"Value Based Care Attribution Analyst Millennium Physician Group Full Time (Monday-Friday 8am-5pm) Remote position Millennium Physician Group is seeking to hire a Full-Time/Attribution Analyst - Value Based Care to join our team. We are looking for a positive, energetic, well-organized candidate, can multi-task and think outside of the box. Additionally, we want someone who supports our top initiative of ensuring an excellent patient experience! This position has the potential to be remote. The Value Based Care Attribution Analyst analyzes patient attribution and retention components of the fast-growing company's various value-based contracts ranging from MSSP ACOs, Medicare Advantage Plans, and Commercial ACOs. This position will participate in the relationship with various payor partners and collaborate with internal stakeholders to deliver enhanced membership and enrollment numbers in value-based contracts. Duties will include utilizing internal MPG data and external payor data to identify patients who should/should not be included in MPG value-based contracts, working with payors to have those members assigned or removed from the contract, and identifying new opportunities to grow membership. Works closely with the company's value-based analytics, payor contracting, and finance teams to ensure appropriate and meaningful collaboration drives results. The position works on multiple projects as a subject matter expert in a fast-paced environment for the support of executive management, physicians, and other internal clients. Essential Duties and Responsibilities: Required Minimum Education/Experience: Preferred Education/Experience: Required Skills and Abilities: This position earns competitive compensation plus a full benefits package including 401(k) with match and 3 weeks of PTO! We also offer opportunities for growth, as well as a great team atmosphere that empowers you to seek better ways to deliver service and take ownership of outcomes in providing quality service and support. For more information about this opportunity, please see the full job description. ABOUT MILLENNIUM PHYSICIAN GROUP Formed in 2008, Millennium Physician Group has grown into one of the largest comprehensive primary care practices with more than 400 health care providers located throughout Florida. With corporate headquarters in Fort Myers, Florida, Millennium Physician Group consists of primary care offices, Imaging Centers, Lab Services, and Wellness Programs. You can also find various programs, such as weight management and smoking cessation, led by Millennium Physician Group doctors. Millennium Physician Group is proud to be an Equal Opportunity Employer and a Drug-Free Workplace. Additionally, Millennium is proud to join the nearly 3,000 health system and physician groups who have gone completely Tobacco Free. ARE YOU READY TO JOIN OUR TEAM? If you feel that you would be right for this position, please click the link to apply today. We look forward to meeting you!",https://www.indeed.com/cmp/Millennium-Physician-Group?campaignid=mobvjcmp&from=mobviewjob&tk=1i2stst9ci02o800&fromjk=07210a1e2f413e83
OrangePeople,Data Analyst (Environmental Accounting/Green House Gas),California,,From $35 an hour,Contract,"We are looking for a dedicated and detail-oriented Net Zero data analyst to join our Net Zero data pod. The successful candidate will play a critical role in supporting the Greenhouse Gas (GHG) and Water data inventory management and forecasting, maintaining data quality, and driving our sustainability initiatives through data improvements. Join us on our journey to shape the future of technology! Primary Responsibilities: Minimum Qualifications: Preferred Qualifications: Job Type: Contract Pay: From $35.00 per hour Benefits: Schedule: Experience: Location: Work Location: Remote",https://www.indeed.com/cmp/Orangepeople?campaignid=mobvjcmp&from=mobviewjob&tk=1i2stt44cgsui800&fromjk=cd6799b7680a4a1d
The Greentree Group,IV&V Business Analyst,,4.3 out of 5,,Full time,,https://www.indeed.com/cmp/The-Greentree-Group-1?campaignid=mobvjcmp&from=mobviewjob&tk=1i2sttaejgst2804&fromjk=5e3149d799c8d3b9
Entegra LLP,Data Analyst I - MFL/GEO Pipeline In-Line Inspection,"11610 Cutten Road, Houston, TX 77066",,,Full time,"ENTEGRA® is the global leader in Ultra-High Resolution (UHR) pipeline in-line inspection technologies, driving innovation in the realm of pipeline integrity. We are a dynamic and forward-thinking company, driven by experienced and talented individuals, advanced processes, and groundbreaking technology. Our commitment is unwavering as we strive to revolutionize the landscape of in-line inspection, setting new standards for excellence.  This is an on-site role at our office location in Houston, Texas. The role requires a minimum of 2 years of experience in interpretation of MFL, Geometry and Inertial mapping pipeline inspection data as well as a current ASNT Data Analysis Level I certification. Position Summary: Data Analysis Level I perform analysis activities including data setup, data searches, feature detection and identification. Final report construction of tables and charts. Primary Responsibilities: Benefits: Entegra is an Equal Opportunity Employer ENTEGRA® is committed to a diverse and inclusive workplace. Entegra is an Equal Opportunity Employer and does not discriminate on the basis of race, color, religion or belief, national origin, age, sexual orientation, sex (including pregnancy), gender, gender identity or expression, family or parental status, protected veteran status, disability status, or any other legally protected status. If you require assistance or would like to request an accommodation related to the application process due to a disability, you may contact us at jobs@entegrasolutions.com.",https://www.indeed.com/cmp/Entegra-3?campaignid=mobvjcmp&from=mobviewjob&tk=1i2sttgm7i02o800&fromjk=7b6a9f609e553af4
HDI Global Insurance Company,Actuarial Analyst,"161 North Clark Street, Chicago, IL 60601",,,,"HDI Global Insurance Company is a commercial property and casualty insurer headquartered in Chicago, IL. We are a wholly owned subsidiary of HDI Global SE, which manages the industrial lines division of the Talanx Group. Our broad and flexible portfolio of products and services combined with our international network of local insurers in more than 150 countries, provide us the ability to offer a wide range of domestic and global insurance solutions for U.S. based multinational companies. Our excess and surplus lines subsidiary, HDI Specialty Insurance Company, gives us the capacity to address even the most unique risks in the U.S. About the role We are searching for an Actuarial Analyst who will play an active role in achieving profitability in support of commercial lines of business. This role will make use of solid analytical, project management and communication skills. The individual will analyze data, develop recommendations and provide business insights. They will perform various types of actuarial analyses and special projects. Key Responsibilities Attention All Applicants: Please use the following link to read HDI's California Personnel Privacy notice: https://acrobat.adobe.com/link/track?uri=urn:aaid:scds:US:0bbddcaf-d738-3af9-bc04-b25f803799ff HDI Global is an Equal Opportunity Employer Individuals seeking employment at HDI Global Insurance Company are considered without regards to race, color, religion, national origin, age, sex, marital status, ancestry, physical or mental disability, veteran status, gender identity, or sexual orientation. HDI Global Insurance Company participates in E-Verify.",https://www.indeed.com/cmp/Hdi-Global-Insurance-Company?campaignid=mobvjcmp&from=mobviewjob&tk=1i2sttmn0i9sr801&fromjk=3e279050e6e18616
Blue Star Partners LLC,Business Analyst - A,"Maple Grove, MN",,$25 - $28 an hour,Full time,"Job Title: Business Analyst - A Location: Maple Grove, MN – Onsite – Local candidates only Period: 07/29/2024 to 06/27/2025, with possibility of extension Hours/Week: 40 hours (Hours over 40 will be paid at Time and a Half) Rate: $25 - $28/hour  Contract Type: W-2 only Scope of Services: The Business Analyst will be a part of the the Product Technology group and will be working in a SOC2, ISO27001, and highly sensitive and secure environment providing platforms and services that Company business partners can leverage to enable connected products (IoT) as well as product customers and clinicians. The primary focus of this position is to help improve processes and systems by assessing current performance and identifying areas for improvement, and designing innovative solutions to enhance operational efficiency and effectiveness. You will work with stakeholders to set goals, develop data collection practices, and analyze current processes. You will then use findings to create plans for improvement and communicate those plans to stakeholders. Role, Responsibilities & Deliverables:  Projects: Education & Experience:",https://www.indeed.com/cmp/Blue-Star-Partners-LLC?campaignid=mobvjcmp&from=mobviewjob&tk=1i2sttsnvi02p800&fromjk=6b725b445e4c303b
Apogee Capital Partners,Junior Business Analyst,"614 South Capital Of Texas Hwy Sb, West Lake Hills, TX 78746",,"$56,010.68 - $88,745.00 a year",Full time,"Overview: We are seeking a skilled Junior Business Analyst to join our team at Apogee Capital Partners. The Junior business analyst is also responsible for underwriting, financial reporting, and financial analysis under the supervision of the managing partners. The ideal candidate will have expertise in various technologies and methodologies to analyze business operations and make recommendations for improvement; planning, underwriting, and reporting to the managing partners of Apogee Capital Partners. As part of the team the analyst is responsible for underwriting, financial reporting, and financial analysis. Responsibilities: - Collaborate with stakeholders to understand business needs and objectives- Conduct data analysis using Excel, Python, R and other tools to extract insights- Develop reports and dashboards using custom software and excel. - Assist with planning and executing the annual financial budget, including balance sheet, income statement, cash flow statement, as well as all quarterly financial forecasting activities for each - Will work with our third party auditors to maintain compliance under the terms of our agreement. - Provide management with weekly, monthly and quarterly financial reports that ultimately are shared with board members or financial institutions. - Assist with short-term and long-term cash forecasting models - Build and refine forecasting models and tools with a 1-5-year horizon - Prepare quarterly presentation materials and supporting models and data requests - Perform business analysis for stakeholders as needed - Support management information system technologies, including in-house software and data storage along with lead process improvement projects that result in enhanced internal and external reporting and forecasting. Qualifications: - Bachelor's degree in Business Administration, Finance, Accounting, Computer Science, or related field - Deep understanding of accounting financials - Some proven experience in business analysis and data interpretation- Proficiency in Excel for data querying and manipulation Nice-to-have Skills: - Experience with server maintenance tasks- Familiarity with additional programming languages like Python- Knowledge of data visualization tools beyond Tableau and Power BI Join us as a Junior Business Analyst to contribute your expertise in analyzing business processes and driving meaningful insights through data analysis. Job Type: Full-time Pay: $56,010.68 - $88,745.00 per year Benefits: Compensation package: Experience level: Schedule: Experience: Ability to Commute: Ability to Relocate: Work Location: In person",https://www.indeed.com/cmp/Apogee-Capital-Partners-1?campaignid=mobvjcmp&from=mobviewjob&tk=1i2stu3tdgsui800&fromjk=5c29b3ea910de5f7
Quantam Solutions,Junior Business Analyst,"Raleigh, NC",,$21.50 - $24.50 an hour,"Full time, Contract","Quantam Solutions provides IT solutions and consulting for the State of North Carolina. We offer a competitive hourly wage, health benefits, paid time off, and a 401(k) plan. We're currently seeking a Business Analyst- Junior. JOB DESCRIPTION: As part of the quality assurance (QA) team, this role will work with the LIMS Manager to support SLPH QA and with the Division's Information Technology team and all laboratory units at SLPH. This role will interact with the Division's IT team to monitor the efficiency of operations in areas related to system implementation, software configuration, and maintenance. PRIMARY RESPONSIBILITIES: REQUIRED SKILLS: PREFERRED SKILLS: Job Types: Full-time, Contract Pay: $21.50 - $24.50 per hour Expected hours: 40 per week Benefits: Experience level: Schedule: Experience: Ability to Commute: Work Location: In person",https://www.indeed.com/cmp/Quantam-Solutions-1?campaignid=mobvjcmp&from=mobviewjob&tk=1i2stua01h3m5804&fromjk=0ae449ab6873dc41
American Bar Association,Data Strategy - Junior Business Intelligence Analyst,"321 North Clark Street, Chicago, IL 60654",3.5 out of 5,"$67,760 - $76,569 a year",Full time,,https://www.indeed.com/cmp/American-Bar-Association?campaignid=mobvjcmp&from=mobviewjob&tk=1i2stugdhi0ij80d&fromjk=b46e33df59ccc925
"Revenova, LLC",Quality Assurance Analyst,"Bannockburn, IL 60015",,"$75,000 a year",Full time,,"https://www.indeed.com/cmp/Revenova,-LLC?campaignid=mobvjcmp&from=mobviewjob&tk=1i2stumgr23jv000&fromjk=dbfb1c46fd749726"
,Analytics and BI Developer/Analyst,"Nashville, TN",,,Full time,"Company Overview: EvidenceCare is a fast-paced, fun-filled tech company scaling their market share with innovative healthcare products. Our products not only address the needs of inefficient healthcare delivery but also disrupt the status quo. EvidenceCare is a unique clinical decision support system (CDSS) because of its EHR-integrated platform that optimizes clinician workflows to deliver better patient care, reduce hospital costs, and capture more revenue. Founded in response to the professional experience of emergency physician Dr. Brian Fengler, the platform provides clinicians with evidence-based care and measurable outcomes.  Company Vision: We envision a day when every clinical decision will deliver the right care at the right time.  Company Mission: Empower better care decisions.  Company Values: Grit, Respect, Innovation, Teamwork, Integrity, and Fun  The type of people who succeed at EvidenceCare: We want go-getters who wake up every day ready to join the next adventure and end the day having accomplished something meaningful. Life is too short not to wake up with a purpose to pursue and a team that encourages you in that pursuit. We want every team member to achieve their dreams while at EvidenceCare and to enjoy the journey together. We want people who communicate well, take ownership of projects, but also work collaboratively in team settings and desire to get a little bit better each day. Position Summary: The Analytics and BI Developer/Analyst will be responsible for developing both internal and external dashboards and reports using our Qlik Sense platform. They will also support the team in the analysis of our product data and associated key measures. This position will work with multiple verticals across EvidenceCare to understand and shape data requirements and strategy. They will leverage this information to perform data loads, analysis, visualization, and storytelling. The ideal candidate has strong knowledge of Qlik Sense and is comfortable working through analytics problems of varying magnitudes. They should thrive in a challenging environment and enjoy participating in and/or owning the entire lifecycle of dashboard creation, from conception to design to finished product.  Roles and Responsibilities:  Minimum requirements:  Experienced with:  Benefits: ",
