company_name,job_title,company_location,company_rating,salary,job_type,job_desc,apply_link
Carpenter's Shelter,Quality Assurance Specialist & Data Analyst,"930 North Henry Street, Alexandria, VA 22314",4.1 out of 5,$20 - $25 an hour,"Part time, Contract","ABOUT CARPENTER’S SHELTER:Since 1988, Carpenter’s Shelter has met the immediate needs of people experiencing homelessness in the City of Alexandria. Through the operation of emergency shelter, day shelter, and winter shelter as well as rapid rehousing and permanent supportive housing programs, Carpenter’s Shelter identifies housing solutions and supports sustainable independence for more than 700 individuals and families each year. POSITION TITLE: Quality Assurance Specialist & Data AnalystREPORTS TO: Deputy DirectorPOSITION TYPE: Part-Time (up to 20 hours per week), Remote Eligible GENERAL SUMMARY: The Quality Assurance Specialist & Data Analyst plays a critical role in ensuring the accuracy, integrity, and quality of data collected and reported by Carpenter’s Shelter. Under the supervisor of the Deputy Director, the Quality Assurance Specialist & Data Analyst is responsible for monitoring and compiling the data for each of the agency’s programs, including rapid rehousing, both year-round emergency shelters, permanent supportive housing, day shelter, winter shelter, medical clinic, educational scholarship, and mental health services. Carpenter’s Shelter is open to filling the position via a contractual arrangement, such as an independent contractor or consultant, in addition to traditional employment. The decision regarding the employment structure will be made based on the qualifications and preferences of the selected candidate and the needs of the organization. Candidates interested in a contractual arrangement are encouraged to indicate their preference in their application. SPECIFIC RESPONSIBILITIES: · Using the Homeless Management Information System (HMIS) and other data collection systems, compile outcomes for the programs Carpenter’s Shelter operates, including rapid rehousing, year-round emergency shelters, permanent supportive housing, day shelter, winter shelter, medical clinic, educational scholarship, and mental health services. · Support the tracking of rapid rehousing rental assistance data and collaborate with finance staff monthly to reconcile. · Collaborate with the Grants Manager to ensure grant and contract report data is collected and prepared for submission. · Prepare monthly, quarterly, and annual reports for program leadership on program outcomes disaggregated by demographics to include simple charts and visuals for easy comprehension. · Regularly monitor and oversee data collection processes for all of Carpenter’s Shelter programs, ensuring accuracy and completeness. · Implement and maintain quality assurance measures to guarantee the accuracy and integrity of all collected data. · Conduct regular audits and checks on data entries to identify and collaborate with program leadership to rectify any discrepancies or errors. · Identify opportunities for process improvement in data collection, analysis, and reporting; propose and implement enhancements to existing systems to streamline data-related workflows. · Implement measures to safeguard the confidentiality and security of collected data; stay informed of best practices in data security and privacy to mitigate risks effectively. · Ensure that data collection and reporting processes adhere to relevant regulatory standards, organizational policies, and program requirements. · Maintain comprehensive documentation of data collection and reporting processes, ensuring transparency and accountability. · Create and update manuals or guidelines for data-related procedures. · Adhere to the Carpenter’s Shelter Code of Ethics and SEED Values · Perform other duties as assigned REQUIRED: · Bachelor’s degree in computer science, statistics, information systems, or business analytics or equivalent experience · At least 1 year of data analysis experience · Strong time management, attention to detail, and analytical organizational skills; reliable and self-motivated · Capable of work independently and as part of a team · Proficient skill level in Microsoft Suites (Word, Excel, Power Point, Teams, SharePoint) · Ability to develop strong working relationships with diverse groups of people · Valid driver’s license and ability to pass a background check PREFERRED: · Knowledge of data visualization tools like Tableau or PowerBI · Experience with Homeless Management Information System (HMIS) · Interest in homeless services, lived experience or direct personal connection to homelessness SALARY: $20-$25 per hour plus PTO and Sick Leave ADA STATEMENT: Carpenter’s Shelter will make reasonable accommodations in compliance with the Americans with Disabilities Act of 1990. EQUAL OPPORTUNITY EMPLOYER: Carpenter’s Shelter is an Equal Opportunity Employer and agrees not to discriminate against any employee or job applicant because of race, color, religion, national origin, sex, pregnancy, childbirth, or related medical conditions, age, gender, physical or mental disability or any other characteristic protected by law. Successful candidates must be committed to working with a culturally diverse population. Job Types: Part-time, Contract Pay: $20.00 - $25.00 per hour Expected hours: No more than 20 per week Benefits: Experience level: Physical setting: Work Location: Hybrid remote in Alexandria, VA 22314",https://www.indeed.com/cmp/Carpenter's-Shelter?campaignid=mobvjcmp&from=mobviewjob&tk=1i2st0779i0ha800&fromjk=d204bfecd6c777a9
"Treatment Centers Hold Co, LLC","Remote Business Intelligence Analyst - Greenville, SC","200 East Broad Street, Greenville, SC 29601",3.7 out of 5,,Full time," Crossroads is a leading addiction treatment provider of outpatient medication-assisted treatment (MAT). We treat patients with opioid use disorder (OUD) using medications such as methadone and suboxone/ buprenorphine. We pride ourselves in supporting our patients’ medical and personal recoveries from substance use disorder. Starting our fight against the opioid addiction crisis in 2005, Crossroads has remained physician led and patient focused as we’ve grown to 100+ clinics across nine states. As an equal opportunity employer, we celebrate diversity and are committed to an inclusive environment for all employees and patients.  Support business partners with effective communication on metrics, benchmarks, and KPIs, with a special focus on operational performance and outcome modeling. Explore data sets and perform statistical analyses to discern and communicate business and industry trends using both new and established analytical solutions. Prepare and communicate high-quality department reports on a set cadence (e.g., weekly, monthly, quarterly) using available technology (i.e., SQL, R, Power BI, etc.). Identify opportunities for business optimization through use of financial and operational data to influence short- and long-term strategy. Work across departments to collaboratively design, develop, document, train, and implement new data solutions and processes based on stakeholder needs. Gather requirements to translate technical and business needs; liaise between shared service departments (e.g., IT) and business stakeholders to optimize tensions/tradeoffs. Ability to collaborate with stakeholders with minimal supervision and quickly analyze/present data in meaningful ways. Enthusiasm for a fast-paced environment, continual change, and learning corporate applications/new software products as necessary to fully support the business.  Bachelor's degree in Analytics, Mathematics, Business Management, or other relevant subject matter, or equivalent in ongoing self-education or commensurate experience. 0-3+ years in business/reporting analyst role required. Healthcare experience preferred. Proficiency in data visualization tools, such as Tableau and/or Power BI, to identify business insights and design tangible steps to improve. Strong proficiency in quantitative analysis using Excel, SQL, or other query languages. Familiarity/experience with project management preferred with strong focus on use case building, requirements creation, and milestone-driven delivery. Proficiency with Microsoft Office Suite. Excellent verbal and written communication skills, with ability to present findings to senior management. Superior problem-solving and logic processing skills to identify business growth opportunities.   This role operates Monday through Friday from 9:00 AM to 5:00 PM EST. The position is requires quarterly travel to corporate office in Greenville, SC.  Have a daily impact on many lives. Excellent training if you are new to this field. Community events that promotes belonging and education. Includes but not limited to community cook outs, various fairs related to addiction treatment and outreach, parades, addiction awareness for schools, and holiday events. Opportunity to save lives everyday!   Medical, Dental, and Vision Insurance PTO Variety of 401K options including a match program with no vesture period Annual Continuing Education Allowance (in related field) Life Insurance Short/Long Term Disability Paid maternity/paternity leave Mental Health day Calm subscription for all employees",https://www.indeed.com/cmp/Crossroads-0c937432?campaignid=mobvjcmp&from=mobviewjob&tk=1i2st0djtgorf80h&fromjk=3a565e4a32d07089
NYC Health + Hospitals,Clinical Business Analyst Level I,"New York, NY",,"$58,300 - $80,000 a year",Full time,"About NYC Health + Hospitals NYC Health + Hospitals/At Home reaches outside the walls of our hospitals and brings health care to patients where they live. With more than 600 dedicated employees, Community Care provides services including home care, community care coordination, and community-based care management to individuals managing chronic health conditions residing in Brooklyn, Manhattan, Queens and The Bronx. At NYC Health + Hospitals, our mission is to deliver high quality care health services, without exception. Every employee takes a person-centered approach that exemplifies the ICARE values (Integrity, Compassion, Accountability, Respect, and Excellence) through empathic communication and partnerships between all persons. Job Description The Business Analyst (BA) is responsible for the delivery of reporting and analytics services offered through the Community Care Business Intelligence team. The overall goal of the Business Analyst is to facilitate the development and enhancement of data reporting assets such as dashboards and reports. SUMMARY OF DUTIES AND RESPONSIBILITIES1) Partner with dashboard/report sponsors to gather requirements, document business processes and workflows, and explore potential solutions with the service delivery teams 2) Document clear and concise requirements ensuring descriptions are complete, consistent, feasible, traceable, and verifiable to support the completion of data related projects (e.g. data dictionaries) 3) Create data solutions that support the stakeholder’s need for report generation, automation, scripting, coding and/or troubleshooting. Provide support and project management assistance with the development and maintenance of shared resources designed to promote cross-user collaboration and record of approved data solutions, policy documents and other vital learning resources (e.g. shared folders, Shareplus, DnA Producer, etc.) 4) Support Business Intelligence team to ensure key deliverables are met in an accurate and timely manner 5) Provide data validation, especially for totals, rates, and additional statistical statements published in reports and dashboards 6) Analyze and interpret business requirements into functional requirements and specifications that have an appropriate level of detail suitable for use by the Business Intelligence team 7) Investigate and resolve Business Intelligence related issues raised by Service Desk or Business Intelligence team 8) Develop scope of work with service delivery teams 9) Work with service delivery team(s) to develop proof of concept and validate with customer's pre-build 10) Verify that solutions meet business, compliance, and technical requirements prior to publication 11) Perform periodic reviews of dashboards/reports to continuously maintain/improve trust 12) Support day-to-day operations and troubleshooting Minimum Qualifications 1. A Master’s degree or advanced clinical degree from an accredited college or university; or 2. A Baccalaureate degree from an accredited college or university and one (1) year of experience gathering and documenting business, clinical, and/or functional requirements for software applications development and implementation in a clinical, allied health, non-allied health, behavioral health, information technology, information services, business, analytics or related area; or, one (1) year of experience in a relevant clinical and/or healthcare administration role/function; or 3. A satisfactory combination of education, training, and experience. 4. Specialty certification(s) issued by a national commercially available program, state, professional society, academic or technical institution in an area(s) listed above, may be credited on a month-to-month basis toward the required work experience for a total of one (1) year. Additional Qualifications QUALIFICATIONS FOR THE JOB: CERTIFICATION(S)/LICENSE(S): YEARS OF EXPERIENCE:2 years minimum KNOWLEDGEABLE IN: COMPUTER PROGRAMS/SOFTWARE OPERATED How To Apply If you wish to apply for this position, please apply online by clicking the ""Apply Now"" button or forward your resume to CommunityCareCareers@nychhc.org noting the above Job ID #.105863 NYC Health and Hospitals offers a competitive benefits package that includes: Job Type: Full-time Pay: $58,300.00 - $80,000.00 per year Benefits: Schedule: Work setting: Education: Experience: Ability to Relocate: Work Location: In person",https://www.indeed.com/cmp/Nyc-Health-Hospitals-452adce2?campaignid=mobvjcmp&from=mobviewjob&tk=1i2st0jn92807001&fromjk=7e1ace7fcf67be43
Innovative Object Solutions Inc,Data Analyst,"Washington, DC 20002",,,Full time,Flexible work from home options available.,https://www.indeed.com/cmp/Innovative-Object-Solutions?campaignid=mobvjcmp&from=mobviewjob&tk=1i2st0po4g07b803&fromjk=da3a356f87aa9388
LIMRA,Data Analyst I,"300 Day Hill Rd, Windsor, CT 06095",3.4 out of 5,,Full time,"For more than a century, LIMRA and LOMA have served as the largest trade association supporting the insurance and related financial services industry. Today, we’re working with over 700 member companies around the world to help them understand industry trends, inform their strategies, develop their talent, and create solutions that advance the industry. Companies come to us because no other organization is in a better position to help them understand their customers, markets, distribution channels, and competitors. Leading life insurance and financial services organizations around the world rely on their membership for one simple reason – they can make bottom-line decisions with greater confidence.  As an employer, we believe that greatness is built from the inside out. It is created by individuals who share common goals, and who support and rely on one another to achieve them. Our core values (Integrity, Customer Focus, Adaptability, Respect and Excellence) guide us in how we treat, respond to and interact with our customers, and one another. We do our best to support our employees in making the most of their lives both inside and outside of work. technical support responsible for ad hoc data requests We are currently look for an Associate Data Analyst to join the Product Research group. This position is an entry level, full-time hybrid position. In this role, you will work closely with LIMRA’s data analysts and researchers on data exploration, validation, editing and analysis.  Responsibilities include understanding the business requirements of each project, selecting the appropriate analytical tools, maintaining research databases, and applying the established best practices to your work. In addition, you will act as a liaison to LIMRA members to provide production support for data submissions.  This position is ideal for you if you're interested in furthering your technical skills and working with industry thought leaders, data experts, and cutting edge technologies. In addition you will also have the opportunity to do the following: Qualifications LIMRA and LOMA are committed to creating an inclusive workplace. Our commitment to diversity, equity, and inclusion extends to hiring individuals with unique perspectives and backgrounds. The range of experiences and viewpoints that our employees bring to work every day is a vital part of how we help members navigate with confidence.  We are an Equal Opportunity employer and do not discriminate on the basis of race, ancestry, color, religion, sex, age, marital status, sexual orientation, national origin, medical condition, disability, veteran status, or any other basis protected by law. This Employer Participates in E-Verify. See the E-Verify notices. Este Empleador Participa en E-Verify. Ver el E-Verify avisos.",https://www.indeed.com/cmp/Limra?campaignid=mobvjcmp&from=mobviewjob&tk=1i2st10c5i02o800&fromjk=8516493ee8c2f0bb
Big Thought,DATA ANALYST,United States,4.3 out of 5,,Full time,"JOB DESCRIPTION: DATA ANALYST Location: Big Thought HQ Reports to: Director/Impact & Advocacy Department: Big Thought Institute Supervision: No Effective Date: JUNE 2024  About the Role: The Data Analyst is responsible for the collection, analysis, and dissemination of data and results based on the evaluation and reporting of BT’s programmatic functions.  About Big Thought: The Big Thought equips youth in marginalized communities to envision and create their best lives and world. What makes our work uniquely effective is the ability to focus on the social and emotional learning and community-centered partnerships based on an equitable and accessibility perspective.  Throughout our 30+ year history of innovation, Big Thought has become a national model in arts education, out of school time systems, summer learning and juvenile justice intervention. Big Thoughts is one of the six community organizations in the U.S to assist in advancing and scaling national best practices in Social and Emotional Learning (SEL). We take a direct-to-youth program approach and offer resources to communities with the greatest needs. We provide and recommend evidence-based best practices with similar nonprofits and organizations through a variety of consultation services, such as professional development, curriculum design, and technical assistance. ESSENTIAL JOB DUTIES: MINIMUM QUALIFICATIONS: Physical Expectations (not an exhaustive list): Big Thought jobs are action-based and can be physically demanding. To be successful in this role, you may regularly be required to: sit, stand, or stare at computer screen for long periods of time; participate in external activities; use various office equipment, work in an environment with loud sounds, multiple distractions, and interruptions. You may also be exposed to extreme temperatures on occasion and must maintain your composure during stressful situations. BIG THOUGHT ASPIRES TO BE A WORKPLACE OF INCLUSION & EQUITY. WE VISUALIZE A WORKPLACE THAT PROVIDES AN EXCEPTIONAL EMPLOYEE EXPERIENCE. WE BELIEVE THE BASELINE REQUIREMENT TO ACHIEVE OUR VISION IS. TO TREAT EVERYONE WITH DIGNITY AND RESPECT. Big Thought is an equal opportunity employer. All applicants will be considered for employment without attention to race, color, religion, sex, sexual orientation, gender identity, national origin, veteran, or disability status. Employees of Big Thought are expected to participate in mission driven activities, meetings, committees, etc. BT is based on a team environment and openness to always lend a hand as appropriate to another employee. All employees are required to adhere to BT policies and procedures. All employees may expect to perform duties as assigned. In addition, all employees may be assigned other duties in the spirit of teamwork. NOTE: This posting is not an employment agreement or contract. The CEO and/or designee has the exclusive right to alter this job description at any time without notice.",https://www.indeed.com/cmp/Big-Thought?campaignid=mobvjcmp&from=mobviewjob&tk=1i2st16g2goqg802&fromjk=a1f117cebdbe619c
ITRGroup,Business Analyst,,,From $24 an hour,Contract,Skills Summary: Preferred/nice to have skills: Job Type: Contract Pay: From $24.00 per hour Experience level: Schedule: Work Location: Remote,https://www.indeed.com/cmp/Itrgroup-1?campaignid=mobvjcmp&from=mobviewjob&tk=1i2st1dtai9sr800&fromjk=9e65340b308a958f
Columbus City Schools,EDUCATIONAL SYSTEMS DATA ANALYST I,"Columbus, OH",3.7 out of 5,$35.86 an hour,Full time,"Overview:This is not a remote position. Under general supervision, is responsible for performing entry-level analysis, interpretation, and validation of data from the student information and educational management information systems; performs related duties as required. Examples of Work · Extracts requested data from a variety of databases and integrates data into required file formats; · Reviews data accuracy and integrity; identifies and analyzes error patterns in data sets; corrects errors by researching sources of information; · Monitors data entries for timely and accurate completion; identifies issues with methods of data gathering, entry, and reporting by staff and system users, such as duplicate entries and overlapping dates; · Learns the specialized methods required by state and federal agencies for submission of educational data; · Assists upper level personnel with identifying ways to facilitate processes to eliminate recurring types of errors; instructs users in new methods; · Writes queries and simple programs to collect and compile specific data needed for reports, as required by local, state, and federal agencies, staff, and users; · Develops routine and ad hoc reports, tables, and graphs; provides assistance to staff in interpreting and analyzing the results; develops custom reports as requested; · Reviews data submitted to external agencies for compliance with all applicable laws and regulations; · May participate in developing standards, policies, and procedures for data retrieval and reporting. Department specific duties & qualifications: Minimum Required Qualifications: Possession of a bachelor's degree with significant coursework (21 semester or 32 quarter hours) in computer science, mathematics, or a closely related field, and one (1) year of experience in data analysis and research. Substitution: Additional years of the specified experience may substitute for the educational requirement on a year-for-year basis. Preferred Qualifications: Knowledge, Skills, and Abilities: General knowledge of data analysis processes and procedures; general knowledge of data quality assurance processes and procedures; general knowledge of relational databases and data retrieval methods; general knowledge of research and problem-solving techniques; general knowledge of documentation and report writing procedures; general knowledge of Microsoft Office software, including Excel; general knowledge of the techniques used to write queries and simple programs; ability to retrieve and manipulate data sets to identify patterns, problems, and errors; ability to use logic and analysis to solve problems; ability to organize and summarize information in written format; ability to communicate effectively, both orally and in writing; ability to develop and maintain effective working relationships with others. Test/Job Contact Information: This job posting is for a noncompetitive position. The candidates that successfully complete the application process will be used to create a NEW eligible list. The hiring department will then conduct a preliminary review of your application to determine who to interview. It is the responsibility of all applicants to list all relevant work experience (current and previous) on the application. Resumes will not be accepted in lieu of listed work experience. Unless otherwise indicated, any year of required experience is based on 12 months of full-time employment. Anything under 35 hours/week (or seasonal work) will be prorated. Please be sure that the job experience and education information in your profile is up to date and accurate before submitting your application. Prior to application completion, please attach an OFFICIAL transcript or copy of degree indicating field of study, if applicable. Job Type: Full-time Pay: $35.86 per hour Benefits: Schedule: Experience: Ability to Commute: Ability to Relocate: Work Location: In person",https://www.indeed.com/cmp/Columbus-City-Schools?campaignid=mobvjcmp&from=mobviewjob&tk=1i2st1js0ggnl801&fromjk=15d39450ce99e9fa
